lab,address,pincode,city,state,type
"RML Mehrotra Pathology Pvt Ltd., Lucknow","RML Mehrotra Pathology Pvt Ltd., A-21/A, Nirala Nagar, Lucknow, Uttar Pradesh 226020",226020,Lucknow,Uttar Pradesh,Private Laboratory
"Department of Laboratory Medicine, Jaypee Hospital, Noida","Department of Laboratory Medicine, Jaypee Hospital, Sector 128, Noida-201304",201304,Noida,Uttar Pradesh,Private Laboratory
"Government Medical College, Haldwani","Government Medical College, Rampur Rd, Rampur, Haldwani, Uttarakhand 263129",263129,Haldwani,Uttarakhand,Government Laboratory
"All India Institute of Medical Sciences (AIIMS), Rishikesh","All India Institute of Medical Sciences (AIIMS), Virbhadra Road Shivaji Nagar, near Barrage, Sturida Colony, Rishikesh, Uttarakhand 249203",249203,Rishikesh,Uttarakhand,Government Laboratory
"Dr. Ahuja’s Pathlogy and Imaging Centre-Department of Laboratory Medicine, Dehradun","Dr. Ahuja’s Pathlogy and Imaging Centre-Department of Laboratory Medicine, 7-B Astley Hall, Ugrasain Rd, Dehradun, Uttarakhand 248001",248001,Dehradun,Uttarakhand,Private Laboratory
"ICMR-National Institute of Cholera & Enteric Diseases (NICED), Kolkata","ICMR-National Institute of Cholera & Enteric Diseases (NICED), P-33, C.I.T. Road, Scheme XM, Beleghata, Kolkata 700 010, India",700010,Kolkata,West Bengal,Government Laboratory
"Institute of Post Graduate Medical Education and Research (IPGMER), Kolkata","Institute of Post Graduate Medical Education and Research (IPGMER), 244, Acharya Jagadish Chandra Bose Rd, Bhowanipore, Kolkata, West Bengal 700020",700020,Kolkata,West Bengal,Government Laboratory
"Midnapore Medical College, Midnapore","Midnapore Medical College, Vidyasagar Road , Paschim Medinipur, Midnapore, West Bengal, 721 101",721101,Midnapore,West Bengal,Government Laboratory
"North Bengal Medical College, Siliguri","North Bengal Medical College, Sushruta Nagar, Siliguri, West Bengal 734012",734012,Siliguri,West Bengal,Government Laboratory
"School of Tropical Medicine, Kolkata","School of Tropical Medicine, 108, Chittaranjan Avenue, Kolkata - 700073, West Bengal",700073,Kolkata,West Bengal,Government Laboratory
"Malda Medical College, Malda","Malda Medical College, Dipak Rd, 3 No. Govt Colony, Uma Roy Sarani, Malda, West Bengal 732101",732101,Malda,West Bengal,Government Laboratory
"Command Hospital (Eastern Command), Kolkata","Command Hospital (Eastern Command), Alipore, Kolkata, Pin- 700027, West Bengal, India",700027,Kolkata,West Bengal,Government Laboratory
"Apollo Gleneagles Hospitals, Kolkata","Apollo Gleneagles Hospitals, 58, Canal Circular Road, Kolkata, West Bengal 700054",700054,Kolkata,West Bengal,Private Laboratory
"Tata Medical Center, Kolkata","Department of Laboratory Sciences, Tata Medical Center, 14, MAR(E-W), DH Block(Newtown), Action Area I, Newtown, Kolkata, West Bengal 700160",700160,Kolkata,West Bengal,Private Laboratory
"Laboratory Services, Peerless Hospitex Hospital & Research Center Limited, Kolkata","Laboratory Services, Peerless Hospitex Hospital & Research Center Limited, 360, Panchasayar, Kolkata, West Bengal 700094, India",700094,Kolkata,West Bengal,Private Laboratory
"AMRI Hospitals, Department of Laboratory Medicine, Kolkata","AMRI Hospitals, Department of Laboratory Medicine, JC 16 & 17, Sector III, Salt Lake City, Kolkata, West Bengal -700098, India",700098,Kolkata,West Bengal,Private Laboratory
"Suraksha Diagnostics Pvt. Ltd., Kolkata","Suraksha Diagnostics Pvt. Ltd., 12/1, Premises No. 02-0327, DG Block, Action Area 1D, Newtown, Kolkata, West Bengal 700156, India",700156,Kolkata,West Bengal,Private Laboratory
"Dr. Lal PathLabs Ltd, Reference Laboratory, Kolkata","Dr. Lal PathLabs Ltd, Reference Laboratory, Plot No. CB-31/1, Premises No. 031-0199, Street No, 199 Action area IC, Newtown, Kolkata-700156, West Bengal",700156,Kolkata,West Bengal,Private Laboratory