lab,address,pincode,city,state,type
"ICMR-Regional Medical Research Centre, Port Blair","ICMR-Regional Medical Research Centre, Post Bag 13, Dollygunj, Port Blair, Andaman and Nicobar Islands 744103",744103,Port Blair,Andaman and Nicobar Islands,Government Laboratory
"Tomo Riba Institute of Health & Medical Sciences, Naharlagun","National Highway 52A, Old Assembly Complex, Naharlagun, Arunachal Pradesh 791110",791110,Naharlagun,Arunachal Pradesh,Collection Site
"Sri Venkateswara Institute of Medical Sciences, Tirupati","Sri Venkateswara Institute of Medical Sciences, Tirupati, Andhra Pradesh Alipiri Rd, Sri Padmavati Mahila Visvavidyalayam, Tirupati, Andhra Pradesh 517507",517507,Tirupati,Andhra Pradesh,Government Laboratory
"Rangaraya Medical College, Kakinada","Rangaraya Medical College, Kakinada Pithampuram Road, Kakinada, Andhra Pradesh 533001",533001,Kakinada,Andhra Pradesh,Government Laboratory
"Sidhartha Medical College, Vijaywada","Siddhartha Medical College, Vijayawada NH 16 Service Rd, beside Dr NTR University of Health Sciences, Gunadala, Vijayawada, Andhra Pradesh 520008",520008,Vijayawada,Andhra Pradesh,Government Laboratory
"Government Medical College, Anantapur","Government Medical College, Anantapur, Rahamat Nagar, Anantapur, Andhra Pradesh 515001",515001,Anantapur,Andhra Pradesh,Government Laboratory
"Guntur Medical College, Guntur","Guntur Medical College, Guntur Kanna Vari Thota, Guntur, Andhra Pradesh 522004",522004,Guntur,Andhra Pradesh,Government Laboratory
"Rajeev Gandhi Institute of Medical Sciences (RIMS), Kadappa","Rajiv Gandhi Institute of Medical Sciences, Kadapa Puttampalli, Andhra Pradesh 516002",516002,Puttampalli,Andhra Pradesh,Government Laboratory
"Andhra Medical College, Vishakhapatnam","Andhra Medical College, Vishakhapatnam, Medical College Road, Opp Collector Office, Maharanipeta, King George Hospital Campus, Andhra Pradesh 530002",530002,Vishakhapatnam,Andhra Pradesh,Government Laboratory
"Gauhati Medical College, Guwahati","Guwahati Narakasur Hilltop, Bhangagarh, Guwahati, Assam 781032",781032,Guwahati,Assam,Government Laboratory
"Regional Medical Research Centre, Dibrugarh","Regional Medical Research Centre, Dibrugarh Bokul, Lahowal, Dibrugarh, Assam, Assam 786001",786001,Dibrugarh,Assam,Government Laboratory
"Jorhat Medical College, Jorhat","Jorhat Medical College, Jorhat Kushal Konwar Path, Barbheta, Jorhat, Assam 785001",785001,Jorhat,Assam,Government Laboratory
"Silchar Medical College, Silchar","Silchar Medical College, Silchar Ghungoor Road, beside Indian Post, Masimpur, Uttar Krishnapur Pt III, Assam 788014",788014,Silchar,Assam,Government Laboratory
"Fakhruddin Medical College, Barpeta","Fakhruddin Medical College, Barpeta-Hospital-Jania Rd, Joti Gaon, Assam 781301",781301,Barpeta,Assam,Government Laboratory
"Tezpur Medical College and Hospital, Tezpur","Tezpur Medical College. Bihaguri, Tezpur 784010, Assam, India",784010,Tezpur,Assam,Government Laboratory
"Rajendra Memorial Research Institute of Medical Sciences, Patna","Rajendra Memorial Research Institute of Medical Sciences, Sadikpur, Patna, Bihar 800007",800007,Patna,Bihar,Government Laboratory
"Indira Gandhi Institute of Medical Sciences, Patna","Indira Gandhi Institute of Medical Sciences, Allahabad bank, Bailey Rd, Sheikhpura, Patna, Bihar 800014",800014,Patna,Bihar,Government Laboratory
"Patna Medical College, Patna","Patna Medical College, Ashok Rajpath, Patna University Campus, Patna, Bihar 800001",800001,Patna,Bihar,Government Laboratory
"Darbhanga Medical College, Darbhanga","Darbhanga Medical College, DMCH Rd, Allalpatti, Laheriasarai, Darbhanga, Bihar 846003",846003,Darbhanga,Bihar,Government Laboratory
"S K Medical College, Muzaffarpur","S K Medical College, Shree Krishna medical college, Uma Nagar, Muzaffarpur, Bihar 842004",842004,Muzaffarpur,Bihar,Government Laboratory
"All India Institute of Medical Sciences (AIIMS), Patna","All India Institute of Medical Sciences, Phulwarisharif, Patna, Bihar 801507, India",801507,Patna,Bihar,Government Laboratory
"Post Graduate Institute of Medical Education & Research, Chandigarh","Post Graduate Institute of Medical Education & Research, Chandigarh, Madhya Marg, Sector 12, Chandigarh, 160012",160012,Chandigarh,Chandigarh,Government Laboratory
"Government Medical College & Hospital, Chandigarh","Government Medical College & Hospital, Chandi Path, Sector 32B, 32B, Sector 32, Chandigarh, 160047",160047,Chandigarh,Chandigarh,Government Laboratory
"CSIR - Institute of Microbial Technology, Chandigarh","CSIR - Institute of Microbial Technology, Sector 39A, Chandigarh, 160036, India",160036,Chandigarh,Chandigarh,Government Laboratory
"All India Institute of Medical Science (AIIMS), Raipur","All India Institute of Medical Science (AIIMS), Great Eastern Rd, AIIMS Campus, Tatibandh, Raipur, Chhattisgarh 492099",492099,Raipur,Chhattisgarh,Government Laboratory
"Late Baliram Kashyap M Govt. Medical College, Jagdalpur","Late Baliram Kashyap M Govt. Medical College, Dimrapal, Jagdalpur, Chhattisgarh 494001",494001,Jagdalpur,Chhattisgarh,Government Laboratory
Pt J.N.M. Medical College Raipur,"Pt. Jawahar Lal Nehru Memorial Medical College, Jail Road, Raipur, Chhattisgarh 492001, India",492001,Raipur,Chhattisgarh,Government Laboratory
"Shri Vinoba Bhave Civil Hospital and NAtional MOdern Medical Education and Research Institute, Silvassa","NAtional MOdern Medical Education and Research Institute and Shri Vinoba Bhave Civil Hospital, Sayali Road, Silvassa Dadra & Nagar Haveli 396230 India",396230,Silvassa,Dadra and Nagar Haveli and Daman and Diu,Government Laboratory
"All India Institute of Medical Sciences, New Delhi","All India Institute of Medical Sciences, Sri Aurobindo Marg, Ansari Nagar, Ansari Nagar East, New Delhi, Delhi 110029",110029,New Delhi,Delhi,Government Laboratory
"Lady Hardinge Medical College, New Delhi","Lady Hardinge Medical College, Connaught Place, New Delhi, Delhi 110001",110001,New Delhi,Delhi,Government Laboratory
"National Centre for Disease Control, New Delhi","National Centre for Disease Control, 22, Sham Nath Marg, Civil Lines, New Delhi, Delhi 110054",110054,New Delhi,Delhi,Government Laboratory
"Ram Manohar Lohia Hospital, New Delhi","Ram Manohar Lohia Hospital, Type III, President's Estate, New Delhi, Delhi 110001",110001,New Delhi,Delhi,Government Laboratory
"Institute of Liver and Biliary Sciences, New Delhi","Institute of Liver and Biliary Sciences, D1 ILBS Road, Vasant Kunj, New Delhi, Delhi 110070",110070,New Delhi,Delhi,Government Laboratory
"Army Hospital Research & Referral, New Delhi","Army Hospital Research & Referral, Military Hospital Road Near, Subroto Park, Dhaula Kuan, New Delhi, Delhi 110010",110010,New Delhi,Delhi,Government Laboratory
"Maulana Azad Medical College, New Delhi","Maulana Azad Medical College, 2, Bahadur Shah Zafar Marg, New Delhi, Delhi 110002",110002,New Delhi,Delhi,Government Laboratory
"Vardhman Mahavir Medical College and Safdarjung Hospital, New Delhi","Vardhman Mahavir Medical College and Safdarjung Hospital, Ansari Nagar East, New Delhi, Delhi 110029",110029,New Delhi,Delhi,Government Laboratory
"Dr Lal PathLabs, National Reference laboratory","Dr Lal PathLabs, National Reference laboratory, B7 Rd, Block E, Sector 18, Rohini, New Delhi, Delhi 110085",110085,New Delhi,Delhi,Private Laboratory
"Dr. Dang’s Lab, New Delhi","Dr. Dang’s Lab, C2/1 SDA Aurbindo Marg, New Delhi 110016",110016,New Delhi,Delhi,Private Laboratory
"Laboratory Services Indraprastha Apollo Hospitals, Sarita Vihar, New Delhi","Laboratory Services Indraprastha Apollo Hospitals, Sarita Vihar, New Delhi 110076",110076,New Delhi,Delhi,Private Laboratory
"Max lab, Max Super Speciality Hospita, Saket, New Delhi","Max lab, Max Super Speciality Hospital, 1, Press Enclave Road, Saket New Delhi 110017",110017,New Delhi,Delhi,Private Laboratory
"Sir ganga ram hospital clinical laboratory services, New Delhi","Sir ganga ram hospital clinical laboratory services, Sarhadi Gandhi Marg, Old Rajinder Nagar, Rajinder Nagar, New Delhi, Delhi 110060",110060,New Delhi,Delhi,Private Laboratory
"ONCQUEST Laboratories Limited, New Delhi","ONCQUEST Laboratories Limited 3-Factory Road, Adjacent Safdarjung Hospital, New Delhi, Delhi 110029",110029,New Delhi,Delhi,Private Laboratory
"Prognosis Laboratories, New Delhi","Prognosis Laboratories, 515-516, behind Gupta Properties, Close to Welcome Hotel (ITC, Sector 19, Pocket 1, Dwarka, New Delhi, Delhi 110075",110075,New Delhi,Delhi,Private Laboratory
"City x-Ray & Scan Clinic Pvt. Ltd., New Delhi","City X Ray & Scan Clinic Pvt. Ltd., Molecular Laboratory, Third Floor,City Imaging Building, 4B/18, Tilak Nagar, Near haldiram, New Delhi 110018",110018,New Delhi,Delhi,Private Laboratory
"Lifeline Laboratory, New Delhi","Lifeline Laboratory, H-11, Green Park Extension, New Delhi, Delhi 110016",110016,New Delhi,Delhi,Private Laboratory
"Department of Laboratory Services, Dr. B.L. Kapur Memorial Hospital New Delhi","Department of Laboratory Services, Dr. B.L. Kapur Memorial Hospital, 5, Pusa Road, New Delhi-110005, India",110005,New Delhi,Delhi,Private Laboratory
"BJ Medical College, Ahmedabad","B j medical college, Asarwa, Civil Hospital Campus, Ahmedabad, Gujarat 380016",380016,Ahmedabad,Gujarat,Government Laboratory
"M. P. Shah Govt Medical College, Jamnagar","M.P. Shah Govt Medical College, Pandit Nehru Marg, Indradeep Society, Jamnagar, Gujarat 361008",361008,Jamnagar,Gujarat,Government Laboratory
"Government Medical College, Surat","Government Medical College, Opp Income Tax Department Office, Majura Gate, Surat, Gujarat 395001",395001,Surat,Gujarat,Government Laboratory
"Government Medical College, Bhavnagar","Government Medical College, Near State Road Transport Corporation Bus Stand, Bhavnagar, Gujarat 364001",364001,Bhavnagar,Gujarat,Government Laboratory
"Government Medical College, Vadodara","Government Medical College, Vinoba Bhave Rd, Anandpura, Vadodara, Gujarat 390001",390001,Vadodara,Gujarat,Government Laboratory
"Government Medical College, Rajkot","Government Medical College, Pandit Dindayal Upadhyay Medical College, Sadar Civil Hospital Campus, Rajkot, Gujarat 360001",360001,Rajkot,Gujarat,Government Laboratory
"Smt. NHL Municipal Medical College, Ahmedabad","Smt. NHL Municipal Medical College, Pritan Rai Cross Road, Ellise Bridge, Paldi, Ahmedabad, Gujarat 380006, India",380006,Ahmedabad,Gujarat,Government Laboratory
"GMERS Medical Collage, Ahmedabad","GMERS Medical Collage, Sola, S.G. Highway, Ahmedabad, Gujarat 380060, India",380060,Ahmedabad,Gujarat,Government Laboratory
"ICMR-National Institute of Occupational Health, Ahmedabad","ICMR-National Institute of Occupational Health, Meghani Nagar, Ahmedabad-380016, Gujarat, India",380016,Ahmedabad,Gujarat,Government Laboratory
"Surat Municipal Institute of Medical Education & Research, Surat","Surat Municipal Institute of Medical Education & Research, Near Sahara Darwaja, Opposite to Bombay Market, Umarwada, Surat- 395010 Gujarat, India",395010,Surat,Gujarat,Government Laboratory
"Unipath Speciality Laboratory Limited, Ahmedabad","Unipath Speciality Laboratory Limited,, 102, 1st Floor, Sanoma Plaza, Sheth Mangald Road, Opp. Parimal Garden, Ellisbridge, Ahmedabad, Gujarat 380006",380006,Ahmedabad,Gujarat,Private Laboratory
"Supratech Micropath Laboratory & Research Institute Pvt. Ltd., Ahmedabad","Supratech Micropath Laboratory & Research Institute Pvt. Ltd., Neuberg Supratech, Ground Floor, Kedar Builiding, Opp. Krupa petrol Pump Parimal garden, Gujarat 380006",380006,Ahmedabad,Gujarat,Private Laboratory
"S. N. GENELAB, Nanpura, Surat","S. N. GENELAB, 2nd Floor, President Plaza-A, Nanpura, Surat, Gujarat, India 395001",395001,Surat,Gujarat,Private Laboratory
"PanGenomics International Pvt. Ltd., Ahmedabad","PanGenomics International Pvt. Ltd., 1st floor sankalp Squre Juna sharda Mandir Cross Road, Ahmedabad, Gujarat 380006",380006,Ahmedabad,Gujarat,Private Laboratory
"Goa Medical College, Bambolim","Goa Medical College and Hospital, Bambolim Bambolim, Tiswadi Goa India 403202",403202,Goa,Goa,Government Laboratory
"Pandit Bhagwat Dayal Sharma Post Graduate Institute of Medical Sciences, Rohtak","Pandit Bhagwat Dayal Sharma Post Graduate Institute of Medical Sciences, SH 16A, Dev Colony, Rohtak, Haryana 124514",124514,Rohtak,Haryana,Government Laboratory
"BPS Government Medical College for Women, Sonipat","Bhagat Phool Singh Government Medical College, Ganaur - Gohana Rd, Khanpur Kalan, Haryana 131305",131305,Sonipat,Haryana,Government Laboratory
"ESIC Medical College and Hospital, Faridabad","ESIC Medical College and Hospital, NH-3, NIT, Faridabad, Haryana",121012,Faridabad,Haryana,Government Laboratory
"ICAR-National Research Centre on Equines, Hisar","ICAR-National Research Centre on Equines, Sirsa Road, Hisar , 125001, Haryana, India",125001,Hisar,Haryana,Government Laboratory
"Kalpana Chawla Government Medical College and Hospital, Karnal","Kalpana Chawla Government Medical College and Hospital, Karnal, Haryana 132001, India",132001,Karnal,Haryana,Government Laboratory
"Strand Life Sciences, Gurugram","Strand Life Sciences, A-17, Info Technology Park, Sector 34, Gurugram, Haryana 122001",122001,Gurugram,Haryana,Private Laboratory
"SRL Limited, Gurugram","SRL Limited, GP 26 Sector 18, Gurugram, Haryana, India Pin 122015",122015,Gurugram,Haryana,Private Laboratory
"Modern Diagnostic & research Centre Laboratory, Gurugram","Modern Diagnostic & research Centre Laboratory, 363-364/4, Jawahar Nagar, New Railway Road, Gurugram-122001, Haryana",122001,Gurugram,Haryana,Private Laboratory
"CORE Diagnostics Pvt Ltd, Gurugram","CORE Diagnostics Pvt Ltd, 406, Udyog Vihar III, Sector 20, Gurugram, Haryana 122016",122016,Gurugram,Haryana,Private Laboratory
"Molq Lab (A Unit of Molecular Quest Healthcare Private Limited), Gurugram","Molq Lab (A Unit of Molecular Quest Healthcare Private Limited), Plot 28-29, Sector 18(P), Electronic City, Udyog Vihar Phase-IV, Gurugram, Haryana 122001",122001,Gurugram,Haryana,Private Laboratory
"PATHKIND Diagnostics Pvt. Ltd., Gurugram","PATHKIND Diagnostics Pvt. Ltd., Plot No. 55, 56, Service Lane, Phase IV, Udyog Vihar, Sector 18, Gurugram, Haryana 122015",122015,Gurugram,Haryana,Private Laboratory
"Indira Gandhi Medical College, Shimla","Indira Gandhi Medical College, Ridge Sanjauli Rd, Lakkar Bazar, Shimla, Himachal Pradesh 171001",171001,Shimla,Himachal Pradesh,Government Laboratory
"Dr. Rajendra Prasad Government Medical College, Tanda","Dr. Rajendra Prasad Government Medical College, Tanda Hospital Rd, Kangra, Himachal Pradesh 176001",176001,Kangra,Himachal Pradesh,Government Laboratory
"Central Research Institute, Kasauli","Central Research Institute, Solan, Kasauli, Himachal Pradesh 173204",173204,Kasauli,Himachal Pradesh,Government Laboratory
"Government Medical College, Jammu","Government Medical College, maheshpura, chowk, Bakshi Nagar, Jammu Cantonment, Jammu and Kashmir 180001",180001,Jammu,Jammu and Kashmir,Government Laboratory
"Command Hospital, Udhampur","Command Hospital, Raghunathpura, Udhampur, Jammu and Kashmir 182101",182101,Udhampur,Jammu and Kashmir,Government Laboratory
"Sher-i -Kashmir Institute of Medical Sciences, Srinagar","Sher - i-Kashmir Institute of Medical Sciences, SKIMS Main Rd, Soura, Srinagar, 190011",190011,Srinagar,Jammu and Kashmir,Government Laboratory
"Government Medical College, Srinagar","Government Medical College, Jammu and Kashmir, Bemina, Srinagar, 190010",190010,Srinagar,Jammu and Kashmir,Government Laboratory
"MGM Medical College, Jamshedpur","MGM Medical College, Dimna Rd, Hill View Colony, Mango, Jamshedpur, Jharkhand 831020",831020,Jamshedpur,Jharkhand,Government Laboratory
"Rajendra Institute of Medical Sciences, Ranchi","Rajendra Institute of Medical Sciences, Cir, Indraprasth Colony, Bariatu, Ranchi, Jharkhand 834009",834009,Ranchi,Jharkhand,Government Laboratory
"Patliputra Medical College & Hospital, Dhanbad","Patliputra Medical College & Hospital, B.C.C.L. Township, Koyla Nagar, Dhanbad - 826005, Jharkhand",826005,Dhanbad,Jharkhand,Government Laboratory
"Hassan Institute of Medical Sciences, Hassan","Hassan Institute of Medical Sciences, Shri panchamukhi medicals and clinic, opp. govt high school, Hassan, Karnataka 573201",573201,Hassan,Karnataka,Government Laboratory
"Mysore Medical College & Research Institute, Mysore","Mysore Medical College & Research Institute, Irwin Road, next to Railway Staion, Mysuru, Karnataka 570001",570001,Mysuru,Karnataka,Government Laboratory
"Shimoga Institute of Medical Sciences, Shivamogga","Shimoga Institute of Medical Sciences, N.H.206, Sagara Road, Shivamogga, Karnataka 577201",577201,Shivamogga,Karnataka,Government Laboratory
Command Hospital (Air Force) Bengaluru,"Command Hospital (Air Force) , Cambridge Rd, Cambridge Layout, Jogupalya, Bengaluru, Karnataka 560007",560007,Bengaluru,Karnataka,Government Laboratory
"Bangalore Medical College & Research Institute, Bangaluru","Bangalore Medical College & Research Institute, Krishna Rajendra Rd, Bengaluru, Karnataka 560002",560002,Bengaluru,Karnataka,Government Laboratory
"National Institute of Virology, Field Unit, Bengaluru","National Institute of Virology, Field Unit, Jaya Nagar 1st Block, Jayanagar, Bengaluru, Karnataka 560011",560011,Bengaluru,Karnataka,Government Laboratory
"Gulbarga Institute Of Medical Sciences, Gulbarga","Gulbarga Institute Of Medical Sciences, Sedam Rd,Veeresh Nagar Cross, behind MRMC, Gulbarga, Karnataka 585101",585101,Gulbarga,Karnataka,Government Laboratory
"National Institute of Mental Health and Neurosciences, Bengaluru","National Institute of Mental Health and Neurosciences,, Hosur Road, Lakkasandra, Hombegowda Nagar, Bengaluru, Karnataka 560029",560029,Bengaluru,Karnataka,Government Laboratory
"Vijayanagar Institute of Medical Science, Bellary","Vijayanagar Institute of Medical Sciences, Contonment, Bellary 583104, Karnataka, India",583104,Bellary,Karnataka,Government Laboratory
"Wenlock District Hospital, Mangalore","Wenlock District Hospital, Hampankatta, Mangalore, Karnataka 575001",575001,Mangalore,Karnataka,Government Laboratory
"Karnataka Institute of Medical Sciences (K.I.M.S.), Hubballi","Karnataka Institute of Medical Sciences (K.I.M.S.), P. B Road, Vidyanagar, Hubli – 580022, Karnataka, India",580022,Hubli,Karnataka,Government Laboratory
"ICMR-National Institute of Traditional Medicine (NITM), Belagavi","ICMR-National Institute of Traditional Medicine (NITM), Nehru Nagar, National Highway No. 4, Belagavi- 590010 Karnataka, India",590010,Belagavi,Karnataka,Government Laboratory
"Neuberg Anand Reference Laboratory, Bengaluru","Neuberg Anand Reference Laboratory, Anand Tower, #54, bowring Hospital Road, Bengaluru, karnataka, India 560001",560001,Bengaluru,Karnataka,Private Laboratory
"Cancyte Technologies Private Limited, Bengaluru","Cancyte Technologies Private Limited, Bengaluru, Karnataka 560018",560018,Bengaluru,Karnataka,Private Laboratory
"Sakra World Hospital Laboratory Services, Bangalore","Sakra World Hospital Laboratory Services, 52/2 & 52/3, Deverabeesanahalli, Varthur Hobli, Bangalore-560103, Karnataka, India",560103,Bengaluru,Karnataka,Private Laboratory
"Central Diagnostic Laboratory, Vydehi Institute of Medical Sciences & Research Centre, Bangalore","Central Diagnostic Laboratory, Vydehi Institute of Medical Sciences & Research Centre, Basement Hospital Building, #82, E.P.I.P. Area, Whitefield, Bangalore-560066, Karnataka",560066,Bengaluru,Karnataka,Private Laboratory
"Laboratory Services, Apollo Hospitals, (A Unit of M/S Imperial Hospital and Research Centre Ltd), Bengaluru","Laboratory Services, Apollo Hospitals, (A Unit of M/S Imperial Hospital and Research Centre Ltd), 154/11, Opp IIM, Bannerghatta Road, Bengaluru - 560 076, Karnataka, India",560076,Bengaluru,Karnataka,Private Laboratory
"National Institute of Virology Field Unit, Allapuzzha","National Institute of Virology Field Unit, Allapuzzha Vandanam, Kerala 688005",688005,Vandanam,Kerala,Government Laboratory
"Government Medical College, Trivandrum","Government Medical College, Ulloor - Akkulam Rd, near SAT hospital Medical College Junction, Chalakkuzhi, Thiruvananthapuram, Kerala 695011",695011,Thiruvananthapuram,Kerala,Government Laboratory
"Government Medical College, Kozhikode","Government Medical College, 17 Medical College Road Medical College Junction, Near Police Station, Kozhikode, Kerala 673008",673008,Kozhikode,Kerala,Government Laboratory
"Government Medical College, Thrissur","Government Medical College, M. G. Kavu, Thrissur, Kerala 680596",680596,Thrissur,Kerala,Government Laboratory
"Rajiv Gandhi Center for Biotechnology, Thiruvananthapuram","Rajiv Gandhi Center for Biotechnology,, Melarannoor Road Behind Central Jail Poojapura, Thycaud, Thiruvananthapuram, Kerala 695014",695014,Thiruvananthapuram,Kerala,Government Laboratory
"Sree Chitra Tirunal Institute for Medical Sciences & Technology, Thiruvananthapuram","Sree Chitra Tirunal Institute for Medical Sciences & Technology, Jai Nagar W Rd, Chalakkuzhi, Thiruvananthapuram, Kerala 695011",695011,Thiruvananthapuram,Kerala,Government Laboratory
"State Public Health Laboratory, Trivandrum","State Public Health Laboratory, Red Cross Road, Near, General Hospital Rd, Rishimangalam, Pattoor, Thiruvananthapuram, Kerala 695024",695024,Thiruvananthapuram,Kerala,Government Laboratory
"Interuniversity, kottayam","Interuniversity, kottayam, Thalappady, Kerala 686019",686019,Thalappady,Kerala,Government Laboratory
"Malabar Cancer Centre, Thalassery","Malabar Cancer Centre, Kodiyeri, Muzhikkara - MCC Rd, Illathaazha, Thalassery, Kerala 670103",670103,Thalassery,Kerala,Government Laboratory
"Central University of Kerala, Kasaragod","Central University of Kerala, Tejaswini Hills, Periye (PO), Kasaragod (DT), Kerala - 671316",671316,Kasaragod,Kerala,Government Laboratory
"DDRC SRL Diagnostics Pvt Ltd, Ernakulam","DDRC SRL Diagnostics Pvt Ltd, DDRC SRL TOWER,G-131, Panampilly Nagar, Ernakulam, Kerala 682036",682036,Ernakulam,Kerala,Private Laboratory
"MIMS Laboratory Services, Kozhikode","Aster MIMS Laboratory Services, Mini, Mini Bypass Rd, Govindapuram, Kozhikode, Kerala 673016",673016,Kozhikode,Kerala,Private Laboratory
"Sonam Nurboo Memorial Hospital, Leh-Ladakh","Sonam Nurboo Memorial Hospital, Old Leh Rd, Leh-Ladakh, Ladakh 194101",194101,Ladakh,Ladakh,Collection Site
"National Institute of Virology, Pune","National Institute of Virology, Pune, 130/1, Pashan - Sus Rd, Pashan Gaon, Pashan, Pune, Maharashtra 411021",411021,Pune,Maharashtra,Government Laboratory
"Seth GS Medical College & KEM Hospital, Mumbai","Seth GS Medical College & KEM Hospital, Acharya Donde Marg, Parel, Mumbai, Maharashtra 400012",400012,Mumbai,Maharashtra,Government Laboratory
"Kasturba Hospital for Infectious Diseases, Mumbai","Kasturba Hospital for Infectious Diseases, Sane Guruji Marg, Arya Nagar, Chinchpokli, Mumbai, Maharashtra 400034",400034,Mumbai,Maharashtra,Government Laboratory
"National Institute of Virology Field Unit, Mumbai","National Institute of Virology Field Unit, Haffkine Institute Compound, A D Marg, Parel Mumbai 4000012",400012,Mumbai,Maharashtra,Government Laboratory
"Armed Forces Medical College, Pune","Armed Forces Medical College, Southern Command, Solapur Road, Wanowrie, near Race Course, Pune, Maharashtra 411040",411040,Pune,Maharashtra,Government Laboratory
"BJ Medical College, Pune","BJ Medical College, Jai Prakash Narayan Road, Railway Station Rd, near Pune, Maharashtra 411001",411001,Pune,Maharashtra,Government Laboratory
"Indira Gandhi Government Medical College & Hospital, Nagpur","Indira Gandhi Government Medical College & Hospital, Mayo Hospital, Central Ave, Mominpura, Nagpur 440018",440018,Nagpur,Maharashtra,Government Laboratory
"Grant Medical College & Sir JJ Hospital, Mumbai","Grant Medical College & Sir JJ Hospital, J J Marg, Nagpada-Mumbai Central, Noor Baug, Mazgaon, Mumbai, Maharashtra 400008",400008,Mumbai,Maharashtra,Government Laboratory
Govt Medical College & Hospital Aurangabad,"Govt Medical College & Hospital, University Road, Jubilee Park, Aurangabad, Maharashtra 431004",431004,Aurangabad,Maharashtra,Government Laboratory
"V. M. Govt. Medical College, Solapur","V. M. Govt. Medical College, Opp. District Court, Solapur, Maharashtra 413003, India",413003,Solapur,Maharashtra,Government Laboratory
"Haffkine Institute, Mumbai","Haffkine Institute, Acharya Donde Marg, Parel, Mumbai 400012, Maharashtra",400012,Mumbai,Maharashtra,Government Laboratory
"Shree Bhausaheb Hire Govt Medical College, Dhule","Shree Bhausaheb Hire Govt Medical College, Chakkarbardi, Malegaon Road, Dhule, Maharashtra 424001",424001,Dhule,Maharashtra,Government Laboratory
"Government Medical College And Hospital, Miraj","Government Medical College And Hospital, Pandharpur Rd, Maji Sainik Vasahat, Miraj, Maharashtra 416410",416410,Miraj,Maharashtra,Government Laboratory
"All India Institute of Medical Sciences (AIIMS), Nagpur","All India Institute of Medical Sciences (AIIMS), Plot No. 2, Sector - 20, MIHAN, Nagpur 441108 Maharashtra",441108,Nagpur,Maharashtra,Government Laboratory
"Nagpur Veterinary College, Nagpur","Department of Veterinary Public Health & Epidemiology, Nagpur Veterinary College. Seminary Hills, Nagpur 440006, Maharashtra",440006,Nagpur,Maharashtra,Government Laboratory
"Advanced Centre for Treatment, Research and Education in Cancer (ACTREC), Tata Memorial Centre, Navi Mumbai","Advanced Centre for Treatment, Research and Education in Cancer (ACTREC), Tata Memorial Centre, Kharghar, Navi Mumbai - 410210, INDIA.",410210,Navi Mumbai,Maharashtra,Government Laboratory
"Govt. Medical College, Akola","Govt. Medical College, Ashok Vatika, District Collector Office Road, Near, Bhandaraj BK, Akola, Maharashtra 444001, India",444001,Mumbai,Maharashtra,Government Laboratory
